{
  "tipo": "criteri-config-valcomp",
  "versione": "2.0",
  "id": "criteri-config-v2.0",
  "descrizione": "Configurazione criteri v2 — input e score dichiarativi per CCROS Valutazione Comparativa",
  "ref_links": {
    "modi": "https://www.agid.gov.it/it/argomenti/interoperabilita",
    "modiHub": "https://www.agid.gov.it/it/infrastrutture/sistema-pubblico-connettivita/il-nuovo-modello-di-interoperabilita",
    "lgInterop": "https://docs.italia.it/italia/pa-digitalizzazione/lg-interoperabilita-docs/it/last/",
    "schemaGov": "https://schema.gov.it",
    "ccros": "https://www.agid.gov.it/it/design-servizi/riuso-open-source/centro-competenza-riuso-open-source",
    "valComparativa": "https://docs.italia.it/italia/developers-italia/lg-acquisizione-e-riuso-software-per-pa-docs/it/stabile/acquisizione-software/valutazione-comparativa.html",
    "developersRiuso": "https://developers.italia.it/it/riuso/",
    "accessibilita": "https://www.agid.gov.it/it/design-servizi/accessibilita",
    "cad68": "https://www.normattiva.it/uri-res/N2Ls?urn:nir:stato:decreto.legislativo:2005-03-07;82!vig=2024-01-01~art68"
  },
  "criteri": [
    {
      "id": "tco",
      "label": "TCO",
      "peso_default": 1,
      "note": "Obbligatorio — Art. 68 CAD",
      "fixed": true,
      "direction": "cost",
      "input": { "type": "tco" },
      "score": { "method": "sum_tco" }
    },
    {
      "id": "interoperabilita",
      "label": "Interoperabilità",
      "peso_default": 0.7,
      "obbligatorio": true,
      "direction": "benefit",
      "input": {
        "type": "si_no",
        "items": [
          { "id": "i1", "testo": "Utilizzo dei protocolli per l'interoperabilità del ModI", "obbligatorio": true },
          { "id": "i2", "testo": "Esposizione Open Data nei formati aperti del ModI", "obbligatorio": true },
          { "id": "i3", "testo": "Utilizzo della semantica e delle ontologie della PA", "obbligatorio": true },
          { "id": "i4", "testo": "Interoperabilità con gli ecosistemi della PA di interesse", "obbligatorio": false }
        ]
      },
      "score": { "method": "count_value", "value": "si" }
    },
    {
      "id": "protezione_dati",
      "label": "Protezione dati personali",
      "peso_default": 0.6,
      "obbligatorio": true,
      "direction": "benefit",
      "input": {
        "type": "si_no",
        "items": [
          { "id": "p1", "testo": "Utilizzo di tecniche di anonimizzazione/pseudonimizzazione", "obbligatorio": true },
          { "id": "p2", "testo": "Utilizzo di crittografia per immagazzinamento, trasferimento e processamento dei dati", "obbligatorio": true },
          { "id": "p3", "testo": "Possibilità di cancellazione definitiva dei dati", "obbligatorio": true }
        ]
      },
      "score": { "method": "count_value", "value": "si" }
    },
    {
      "id": "sicurezza",
      "label": "Sicurezza",
      "peso_default": 0.8,
      "obbligatorio": true,
      "direction": "benefit",
      "input": {
        "type": "si_no",
        "items": [
          { "id": "s1", "testo": "Utilizzo dei protocolli per autenticazione e autorizzazione del ModI", "obbligatorio": true },
          { "id": "s2", "testo": "Utilizzo dei protocolli per integrità e confidenzialità del ModI", "obbligatorio": true }
        ]
      },
      "score": { "method": "count_value", "value": "si" }
    },
    {
      "id": "accessibilita",
      "label": "Accessibilità",
      "peso_default": 0,
      "obbligatorio": true,
      "direction": "benefit",
      "input": {
        "type": "scelta_unica",
        "items": [
          { "id": "a0", "testo": "Il software NON è conforme alle Linee guida sull'accessibilità", "valore": 0 },
          { "id": "a1", "testo": "Il software è PARZIALMENTE conforme alle Linee guida sull'accessibilità", "valore": 1 },
          { "id": "a2", "testo": "Il software è DEL TUTTO conforme alle Linee guida sull'accessibilità", "valore": 2 }
        ]
      },
      "score": { "method": "selected_value" }
    },
    {
      "id": "copertura_req",
      "label": "Copertura requisiti",
      "peso_default": 0,
      "note": "Compilare lo step Requisiti",
      "direction": "benefit",
      "input": { "type": "requisiti_percent" },
      "score": { "method": "weighted_average_percent", "weight_field": "peso" }
    },
    {
      "id": "manutentore",
      "label": "Manutentore",
      "peso_default": 0,
      "direction": "benefit",
      "input": {
        "type": "scelta_unica",
        "items": [
          { "id": "m0", "testo": "Assenza di manutentori esterni", "valore": 0 },
          { "id": "m1", "testo": "Presenza di manutentori esterni nel mercato", "valore": 1 },
          { "id": "m2", "testo": "Presenza di manutentori esterni in-house o nella PA", "valore": 2 }
        ]
      },
      "score": { "method": "selected_value" }
    },
    {
      "id": "supporto",
      "label": "Supporto",
      "peso_default": 0,
      "direction": "benefit",
      "input": {
        "type": "si_no_na",
        "items": [
          { "id": "su1", "testo": "Presenza di accordi con terzi per supporto di installazione/personalizzazione" },
          { "id": "su2", "testo": "Presenza di soggetti in grado di fornire supporto (N/A = non applicabile)" }
        ]
      },
      "score": {
        "method": "count_value_with_override",
        "value": "si",
        "if_any": { "value": "na", "then": 3 }
      }
    },
    {
      "id": "dipendenze",
      "label": "Dipendenze",
      "peso_default": 0,
      "note": "Criterio costo (meno = meglio)",
      "direction": "cost",
      "input": {
        "type": "campi_numerici",
        "fields": [
          { "id": "proprietario", "label": "Dipendenze proprietarie" },
          { "id": "opensource", "label": "Dipendenze open source" }
        ]
      },
      "score": {
        "method": "linear_combination",
        "terms": [
          { "field": "proprietario", "factor": 2 },
          { "field": "opensource", "factor": 1 }
        ]
      }
    },
    {
      "id": "competenze_pa",
      "label": "Competenze PA",
      "peso_default": 0,
      "direction": "benefit",
      "input": {
        "type": "scelta_unica",
        "items": [
          { "id": "c0", "testo": "Le risorse PA NON hanno alcuna competenza", "valore": 0 },
          { "id": "c1", "testo": "Le risorse PA hanno competenza LIMITATA", "valore": 1 },
          { "id": "c2", "testo": "Le risorse PA hanno competenza ECCELLENTE", "valore": 2 }
        ]
      },
      "score": { "method": "selected_value" }
    },
    {
      "id": "numero_pa",
      "label": "Numero PA",
      "peso_default": 0,
      "direction": "benefit",
      "input": {
        "type": "campi_numerici",
        "fields": [
          { "id": "utilizzano", "label": "PA che utilizzano" },
          { "id": "interessate", "label": "PA interessate" }
        ]
      },
      "score": { "method": "sum_fields" }
    },
    {
      "id": "vitalita",
      "label": "Vitalità",
      "peso_default": 0.8,
      "direction": "benefit",
      "input": {
        "type": "vitalita",
        "fields": [
          { "id": "giorni", "label": "Giorni dall'ultimo commit" },
          { "id": "commit", "label": "Commit (3 anni)" },
          { "id": "contributi", "label": "Contributori (3 anni)" },
          { "id": "release", "label": "Release (3 anni)" }
        ]
      },
      "score": {
        "method": "vitalita",
        "requires_nonzero": "commit",
        "giorni_soglia": 365,
        "weights": { "commit": 0.4, "contributi": 0.15, "release": 0.15, "giorni_bonus": 0.3 }
      }
    }
  ],
  "pesi_preset": {
    "gestione-progetti": { "tco": 1, "interoperabilita": 1, "protezione_dati": 1, "sicurezza": 1, "accessibilita": 0.7, "copertura_req": 0, "manutentore": 0.5, "supporto": 0.7, "dipendenze": 0.6, "competenze_pa": 0, "numero_pa": 0, "vitalita": 0.8 },
    "comunicazione": { "tco": 1, "interoperabilita": 1, "protezione_dati": 1, "sicurezza": 1, "accessibilita": 0.5, "copertura_req": 0, "manutentore": 0.6, "supporto": 0, "dipendenze": 0, "competenze_pa": 0, "numero_pa": 0, "vitalita": 0.8 },
    "ufficio-contabilita": { "tco": 1, "interoperabilita": 1, "protezione_dati": 1, "sicurezza": 1, "accessibilita": 0.8, "copertura_req": 0, "manutentore": 0.5, "supporto": 0.8, "dipendenze": 0.6, "competenze_pa": 0, "numero_pa": 0, "vitalita": 0.8 },
    "sviluppo-software": { "tco": 1, "interoperabilita": 1, "protezione_dati": 1, "sicurezza": 1, "accessibilita": 0, "copertura_req": 0, "manutentore": 0.6, "supporto": 0, "dipendenze": 0, "competenze_pa": 0, "numero_pa": 0, "vitalita": 0.8 },
    "scientifico-ingegneria": { "tco": 1, "interoperabilita": 1, "protezione_dati": 1, "sicurezza": 1, "accessibilita": 0.7, "copertura_req": 0, "manutentore": 1, "supporto": 0.6, "dipendenze": 0, "competenze_pa": 0, "numero_pa": 0, "vitalita": 0.8 },
    "multimedia": { "tco": 1, "interoperabilita": 1, "protezione_dati": 1, "sicurezza": 1, "accessibilita": 0.7, "copertura_req": 0, "manutentore": 0.5, "supporto": 0.7, "dipendenze": 0.6, "competenze_pa": 0, "numero_pa": 0, "vitalita": 0.8 },
    "sicurezza": { "tco": 1, "interoperabilita": 1, "protezione_dati": 1, "sicurezza": 1, "accessibilita": 0.8, "copertura_req": 0, "manutentore": 0.7, "supporto": 0.8, "dipendenze": 0.6, "competenze_pa": 0, "numero_pa": 0, "vitalita": 0.8 },
    "ludicizzazione": { "tco": 1, "interoperabilita": 1, "protezione_dati": 1, "sicurezza": 1, "accessibilita": 0.5, "copertura_req": 0, "manutentore": 0.6, "supporto": 0, "dipendenze": 0, "competenze_pa": 0, "numero_pa": 0, "vitalita": 0.8 },
    "altro": { "tco": 1, "interoperabilita": 1, "protezione_dati": 1, "sicurezza": 1, "accessibilita": 0.7, "copertura_req": 0, "manutentore": 0.6, "supporto": 0, "dipendenze": 0, "competenze_pa": 0, "numero_pa": 0, "vitalita": 0.8 }
  },
  "categorie_preset": [
    { "id": "gestione-progetti", "label": "Gestione progetti" },
    { "id": "comunicazione", "label": "Comunicazione" },